<?xml version="1.0"?>
<configurationFile xmlns="https://github.com/RMajewski/testsuite"
				   xmlns:xsi="http://www.w3.org/2001/XMLSchema-instance"
				   xsi:schemaLocation="https://github.com/RMajewski/testsuite
				   https://raw.githubusercontent.com/RMajewski/testsuite/master/src/resources/xml/config.xsd">
	<config>
		<resultPath>result</resultPath>
		<srcPath>src</srcPath>
		<libPath>..</libPath>
		<maxDuration>30000</maxDuration>
		<htmlOut>true</htmlOut>
		<systemProperty>
			<property>testing="true"</property>
		</systemProperty>
		<classpath>
			<path>bin</path>
		</classpath>
		<stylesheet>
			<file>resources/html/out.css</file>
			<file>resources/html/checksource.css</file>
		</stylesheet>
		<javascript>
			<file>resources/html/out.js</file>
		</javascript>
		<todo>
			<name>OPT</name>
			<name>FIX</name>
			<name>TODO</name>
		</todo>
		<checkSourceConfig>
			<noneTestedList path="src/org">true</noneTestedList>
			<lineWidth tabSpace="4">80</lineWidth>
			<parser timeout="20000" parse="true">org.testsuite.checksource.JdbParser</parser>
			<path>org.testsuite.checksource.tests</path>
			<test>TestEmptyLines</test>
			<test>TestEmptyMethod</test>
			<test>TestJavadoc</test>
			<test>TestToWideLines</test>
			<test>TestUnusedImports</test>
		</checkSourceConfig>
	</config>
	
	<testGroup>
		<testRunner>org.testsuite.core.JunitTestRunner</testRunner>
		<description>[h2]Tests the check source[/h2][p]Tests the classes of checksource package with JUnit.[/p]</description>
		<extension>java</extension>
		<libraries>
			<library version="4.12" name="junit" path="/usr/share/eclipse/plugins/org.junit_4.12.0.v201504281640">junit.jar</library>
			<library version="1.10.19" name="Mockito">mockito-all-1.10.19.jar</library>
			<library version="1.6.3" name="PowerMockito">powermock-mockito-1.6.3-full.jar</library>
			<library version="2.2.2" name="cglib">cglib-nodep-2.2.2.jar</library>
			<library version="3.20.0" name="javassist">javassist-3.20.0-GA.jar</library>
			<library version="2.1" name="objenesis">objenesis-2.1.jar</library>
			<library version="1.3.0" name="hamcrest" path="/usr/share/eclipse/plugins/">org.hamcrest.core_1.3.0.v201303031735.jar</library>
		</libraries>
		<testSuite>
			<name>Tests the English language files</name>
			<package>tests.lang.en</package>
			<test>TestChecksourceHtmlOut</test>
			<test>TestChecksourceTests</test>
		</testSuite>
		<testSuite>
			<name>Tests the German language files</name>
			<package>tests.lang.de_DE</package>
			<test>TestChecksourceHtmlOut_de</test>
			<test>TestChecksourceTests_de</test>
		</testSuite>
		<testSuite>
			<name>Tests the class of helper</name>
			<package>tests.testsuite.helper</package>
			<test checkSource="org.testsuite.helper.HelperHtml">TestHelperHtml</test>
			<test checkSource="org.testsuite.helper.HelperHtmlCodeJava">TestHelperHtmlCodeJava</test>
			<test checkSource="org.testsuite.helper.HelperUsedColor">TestHelperUsedColor</test>
		</testSuite>
		<testSuite>
			<name>Tests the annotations</name>
			<package>tests.testsuite.checksource.annotation</package>
			<test checkSource="org.testsuite.checksource.annotation.CheckSource">TestCheckSource</test>
		</testSuite>
		<testSuite>
			<name>Tests the classes of configuration</name>
			<package>tests.testsuite.checksource</package>
			<test checkSource="org.testsuite.checksource.CSConfig">TestCSConfig</test>
		</testSuite>
		<testSuite>
			<name>Tests the classes of informations</name>
			<package>tests.testsuite.checksource</package>
			<test checkSource="org.testsuite.checksource.CSMethod">TestCSMethod</test>
			<test checkSource="org.testsuite.checksource.CSParameter">TestCSParameter</test>
			<test checkSource="org.testsuite.checksource.MessageColor">TestMessageColor</test>
		</testSuite>
		<testSuite>
			<name>Tests the classes for read the source files</name>
			<package>tests.testsuite.checksource</package>
			<test checkSource="org.testsuite.checksource.Read">TestRead</test>
			<test checkSource="org.testsuite.checksource.ReadSource">TestReadSource</test>
			<test checkSource="org.testsuite.checksource.ReadTest">TestReadTest</test>
			<test checkSource="org.testsuite.checksource.SourceLine">TestSourceLine</test>
			<test checkSource="org.testsuite.checksource.SourceFile">TestSourceFile</test>
		</testSuite>
		<testSuite>
			<name>Tests the classes for parser</name>
			<package>tests.testsuite.checksource</package>
			<test checkSource="org.testsuite.checksource.Parser">TestParser</test>
			<test checkSource="org.testsuite.checksource.JdbParser">TestJdbParser</test>
		</testSuite>
		<testSuite>
			<name>Tests the classes for check source</name>
			<package>tests.testsuite.checksource</package>
			<test checkSource="org.testsuite.checksource.CheckSource">TestCheckSource</test>
		</testSuite>
		<testSuite>
			<name>Tests the output</name>
			<package>tests.testsuite.checksource.html</package>
			<test checkSource="org.testsuite.checksource.html.Html">TestHtml</test>
			<test checkSource="org.testsuite.checksource.html.HtmlOut">TestHtmlOut</test>
			<test checkSource="org.testsuite.checksource.html.HtmlOutOverview">TestHtmlOutOverview</test>
			<test checkSource="org.testsuite.checksource.html.HtmlDeprecated">TestHtmlDeprecated</test>
			<test checkSource="org.testsuite.checksource.html.HtmlMenu">TestHtmlMenu</test>
			<test checkSource="org.testsuite.checksource.html.HtmlNoneExistFile">TestHtmlNoneExistFile</test>
			<test checkSource="org.testsuite.checksource.html.HtmlNoneTestedMethods">TestHtmlNoneTestedMethods</test>
			<test checkSource="org.testsuite.checksource.html.HtmlNoneTestedSourceFiles">TestHtmlNoneTestedSourceFiles</test>
			<test checkSource="org.testsuite.checksource.html.HtmlTodo">TestHtmlTodo</test>
		</testSuite>
		<testSuite>
			<name>Tests for check source tests</name>
			<package>tests.testsuite.checksource.tests</package>
			<test checkSource="org.testsuite.checksource.tests.SourceTest">TestSourceTest</test>
			<test checkSource="org.testsuite.checksource.tests.TestEmptyLines">TestTestEmptyLines</test>
			<test checkSource="org.testsuite.checksource.tests.TestEmptyMethod">TestTestEmptyMethod</test>
			<test checkSource="org.testsuite.checksource.tests.TestUnusedImports">TestTestUnusedImports</test>
			<test checkSource="org.testsuite.checksource.tests.TestJavadoc">TestTestJavadoc</test>
			<test checkSource="org.testsuite.checksource.tests.TestToWideLines">TestTestToWideLines</test>
		</testSuite>
	</testGroup>
</configurationFile>