<?xml version="1.0"?>
<configurationFile xmlns="https://github.com/RMajewski/testsuite"
				   xmlns:xsi="http://www.w3.org/2001/XMLSchema-instance"
				   xsi:schemaLocation="https://github.com/RMajewski/testsuite
				   https://raw.githubusercontent.com/RMajewski/testsuite/master/src/resources/xml/config.xsd">
	<config>
		<resultPath>result</resultPath>
		<srcPath>src</srcPath>
		<libPath>..</libPath>
		<maxDuration>30000</maxDuration>
		<htmlOut>true</htmlOut>
		<systemProperty>
			<property>testing="true"</property>
		</systemProperty>
		<classpath>
			<path>bin</path>
		</classpath>
		<stylesheet>
			<file>resources/html/out.css</file>
		</stylesheet>
		<javascript>
			<file>resources/html/out.js</file>
		</javascript>
	</config>
	
	<testGroup>
		<testRunner>org.testsuite.core.JunitTestRunner</testRunner>
		<description>[h2]Test with junit[/h2][p]This are tests with junit framework.[/p]</description>
		<extension>java</extension>
		<libraries>
			<library version="4.12" name="junit" path="/usr/share/eclipse/plugins/org.junit_4.12.0.v201504281640">junit.jar</library>
			<library version="1.10.19" name="Mockito">mockito-all-1.10.19.jar</library>
			<library version="1.6.3" name="PowerMockito">powermock-mockito-1.6.3-full.jar</library>
			<library version="2.2.2" name="cglib">cglib-nodep-2.2.2.jar</library>
			<library version="3.20.0" name="javassist">javassist-3.20.0-GA.jar</library>
			<library version="2.1" name="objenesis">objenesis-2.1.jar</library>
			<library version="1.3.0" name="hamcrest" path="/usr/share/eclipse/plugins/">org.hamcrest.core_1.3.0.v201303031735.jar</library>
		</libraries>
		<testSuite>
			<name>Test org.testsuite.Core</name>
			<package>tests.testsuite.core</package>
			<test>TestConfigParser</test>
		</testSuite>
		<testSuite>
			<name>Test org.testsuite.Data</name>
			<package>tests.testsuite.data</package>
			<test jvm="false">TestConfig</test>
			<test>TestTest</test>
		</testSuite>
	</testGroup>
</configurationFile>